{
  "diagnostics": [
    {
      "code": "DirectionMismatch",
      "hints": [],
      "labels": [
        {
          "message": "source endpoint must be an output",
          "span": {
            "column": 11,
            "end": 294,
            "line": 19,
            "start": 290
          },
          "style": "primary"
        }
      ],
      "message": "source endpoint `c.rx` is not an output port",
      "nodes": [
        {
          "kind": "endpoint",
          "name": "c.rx"
        },
        {
          "kind": "port",
          "name": "Consumer.rx"
        }
      ],
      "repair_action": "reverse_connection",
      "severity": "error",
      "span": {
        "column": 11,
        "end": 294,
        "line": 19,
        "start": 290
      }
    },
    {
      "code": "DirectionMismatch",
      "hints": [],
      "labels": [
        {
          "message": "sink endpoint must be an input",
          "span": {
            "column": 19,
            "end": 302,
            "line": 19,
            "start": 298
          },
          "style": "primary"
        }
      ],
      "message": "sink endpoint `p.tx` is not an input port",
      "nodes": [
        {
          "kind": "endpoint",
          "name": "p.tx"
        },
        {
          "kind": "port",
          "name": "Producer.tx"
        }
      ],
      "repair_action": "reverse_connection",
      "severity": "error",
      "span": {
        "column": 19,
        "end": 302,
        "line": 19,
        "start": 298
      }
    }
  ],
  "ok": false,
  "phase": "check",
  "schema_version": "mico.diagnostics.v0"
}
